{
  "event_id": "1111111111111111111111111111111111111111111111111111111111111111",
  "oid": "OID-VEHICLE-0420",
  "timestamp": "2026-02-21T10:00:01Z",
  "sequence": 98,
  "prev_event_hash": "0000000000000000000000000000000000000000000000000000000000000000",
  "action_type": "emergency_brake",
  "risk_level": "R4",
  "input_digest": "2222222222222222222222222222222222222222222222222222222222222222",
  "decision_digest": "3333333333333333333333333333333333333333333333333333333333333333",
  "state_digest": "4444444444444444444444444444444444444444444444444444444444444444",
  "firmware_hash": "5555555555555555555555555555555555555555555555555555555555555555",
  "model_hash": "6666666666666666666666666666666666666666666666666666666666666666",
  "signature": "BASE64_OR_HEX_SIGNATURE_PLACEHOLDER"
}
