{
  "event_id": "9999999999999999999999999999999999999999999999999999999999999999",
  "oid": "OID-AI-AGENT-01",
  "timestamp": "2026-02-21T10:00:02Z",
  "sequence": 12,
  "prev_event_hash": "8888888888888888888888888888888888888888888888888888888888888888",
  "action_type": "resource_allocation",
  "risk_level": "R1",
  "input_digest": "7777777777777777777777777777777777777777777777777777777777777777",
  "decision_digest": "6666666666666666666666666666666666666666666666666666666666666666",
  "state_digest": "5555555555555555555555555555555555555555555555555555555555555555",
  "firmware_hash": "4444444444444444444444444444444444444444444444444444444444444444",
  "model_hash": "3333333333333333333333333333333333333333333333333333333333333333",
  "signature": "BASE64_OR_HEX_SIGNATURE_PLACEHOLDER"
}
